"No.","Time","Source","Destination","Protocol","Length","Info"
"1","0.000000","145.254.160.237","65.208.228.223","TCP","62","3372  >  80 [SYN] Seq=0 Win=8760 Len=0 MSS=1460 SACK_PERM=1"
"2","0.911310","65.208.228.223","145.254.160.237","TCP","62","80  >  3372 [SYN, ACK] Seq=0 Ack=1 Win=5840 Len=0 MSS=1380 SACK_PERM=1"
"3","0.911310","145.254.160.237","65.208.228.223","TCP","54","3372  >  80 [ACK] Seq=1 Ack=1 Win=9660 Len=0"
"4","0.911310","145.254.160.237","65.208.228.223","HTTP","533","GET /download.html HTTP/1.1 "
"5","1.472116","65.208.228.223","145.254.160.237","TCP","54","80  >  3372 [ACK] Seq=1 Ack=480 Win=6432 Len=0"
"6","1.682419","65.208.228.223","145.254.160.237","TCP","1434","80  >  3372 [ACK] Seq=1 Ack=480 Win=6432 Len=1380 [TCP segment of a reassembled PDU]"
"7","1.812606","145.254.160.237","65.208.228.223","TCP","54","3372  >  80 [ACK] Seq=480 Ack=1381 Win=9660 Len=0"
"8","1.812606","65.208.228.223","145.254.160.237","TCP","1434","80  >  3372 [ACK] Seq=1381 Ack=480 Win=6432 Len=1380 [TCP segment of a reassembled PDU]"
"9","2.012894","145.254.160.237","65.208.228.223","TCP","54","3372  >  80 [ACK] Seq=480 Ack=2761 Win=9660 Len=0"
"10","2.443513","65.208.228.223","145.254.160.237","TCP","1434","80  >  3372 [ACK] Seq=2761 Ack=480 Win=6432 Len=1380 [TCP segment of a reassembled PDU]"
"11","2.553672","65.208.228.223","145.254.160.237","TCP","1434","80  >  3372 [PSH, ACK] Seq=4141 Ack=480 Win=6432 Len=1380 [TCP segment of a reassembled PDU]"
"12","2.553672","145.254.160.237","65.208.228.223","TCP","54","3372  >  80 [ACK] Seq=480 Ack=5521 Win=9660 Len=0"
"13","2.553672","145.254.160.237","145.253.2.203","DNS","89","Standard query 0x0023 A pagead2.googlesyndication.com"
"14","2.633787","65.208.228.223","145.254.160.237","TCP","1434","80  >  3372 [ACK] Seq=5521 Ack=480 Win=6432 Len=1380 [TCP segment of a reassembled PDU]"
"15","2.814046","145.254.160.237","65.208.228.223","TCP","54","3372  >  80 [ACK] Seq=480 Ack=6901 Win=9660 Len=0"
"16","2.894161","65.208.228.223","145.254.160.237","TCP","1434","80  >  3372 [ACK] Seq=6901 Ack=480 Win=6432 Len=1380 [TCP segment of a reassembled PDU]"
"17","2.914190","145.253.2.203","145.254.160.237","DNS","188","Standard query response 0x0023 A pagead2.googlesyndication.com CNAME pagead2.google.com CNAME pagead.google.akadns.net A 216.239.59.104 A 216.239.59.99"
"18","2.984291","145.254.160.237","216.239.59.99","HTTP","775","GET /pagead/ads?client=ca-pub-2309191948673629&random=1084443430285&lmt=1082467020&format=468x60_as&output=html&url=http%3A%2F%2Fwww.ethereal.com%2Fdownload.html&color_bg=FFFFFF&color_text=333333&color_link=000000&color_url=666633&color_border=666633 HTTP/1.1 "
"19","3.014334","145.254.160.237","65.208.228.223","TCP","54","3372  >  80 [ACK] Seq=480 Ack=8281 Win=9660 Len=0"
"20","3.374852","65.208.228.223","145.254.160.237","TCP","1434","80  >  3372 [ACK] Seq=8281 Ack=480 Win=6432 Len=1380 [TCP segment of a reassembled PDU]"
"21","3.495025","65.208.228.223","145.254.160.237","TCP","1434","80  >  3372 [PSH, ACK] Seq=9661 Ack=480 Win=6432 Len=1380 [TCP segment of a reassembled PDU]"
"22","3.495025","145.254.160.237","65.208.228.223","TCP","54","3372  >  80 [ACK] Seq=480 Ack=11041 Win=9660 Len=0"
"23","3.635227","65.208.228.223","145.254.160.237","TCP","1434","80  >  3372 [ACK] Seq=11041 Ack=480 Win=6432 Len=1380 [TCP segment of a reassembled PDU]"
"24","3.645241","216.239.59.99","145.254.160.237","TCP","54","80  >  3371 [ACK] Seq=1 Ack=722 Win=31460 Len=0"
"25","3.815486","145.254.160.237","65.208.228.223","TCP","54","3372  >  80 [ACK] Seq=480 Ack=12421 Win=9660 Len=0"
"26","3.915630","216.239.59.99","145.254.160.237","TCP","1484","80  >  3371 [PSH, ACK] Seq=1 Ack=722 Win=31460 Len=1430 [TCP segment of a reassembled PDU]"
"27","3.955688","216.239.59.99","145.254.160.237","HTTP","214","HTTP/1.1 200 OK  (text/html)"
"28","3.955688","145.254.160.237","216.239.59.99","TCP","54","3371  >  80 [ACK] Seq=722 Ack=1591 Win=8760 Len=0"
"29","4.105904","65.208.228.223","145.254.160.237","TCP","1434","80  >  3372 [PSH, ACK] Seq=12421 Ack=480 Win=6432 Len=1380 [TCP segment of a reassembled PDU]"
"30","4.216062","145.254.160.237","65.208.228.223","TCP","54","3372  >  80 [ACK] Seq=480 Ack=13801 Win=9660 Len=0"
"31","4.226076","65.208.228.223","145.254.160.237","TCP","1434","80  >  3372 [ACK] Seq=13801 Ack=480 Win=6432 Len=1380 [TCP segment of a reassembled PDU]"
"32","4.356264","65.208.228.223","145.254.160.237","TCP","1434","80  >  3372 [ACK] Seq=15181 Ack=480 Win=6432 Len=1380 [TCP segment of a reassembled PDU]"
"33","4.356264","145.254.160.237","65.208.228.223","TCP","54","3372  >  80 [ACK] Seq=480 Ack=16561 Win=9660 Len=0"
"34","4.496465","65.208.228.223","145.254.160.237","TCP","1434","80  >  3372 [ACK] Seq=16561 Ack=480 Win=6432 Len=1380 [TCP segment of a reassembled PDU]"
"35","4.496465","145.254.160.237","65.208.228.223","TCP","54","3372  >  80 [ACK] Seq=480 Ack=17941 Win=9660 Len=0"
"36","4.776868","216.239.59.99","145.254.160.237","TCP","1484","[TCP Spurious Retransmission] 80  >  3371 [PSH, ACK] Seq=1 Ack=722 Win=31460 Len=1430"
"37","4.776868","145.254.160.237","216.239.59.99","TCP","54","[TCP Dup ACK 28#1] 3371  >  80 [ACK] Seq=722 Ack=1591 Win=8760 Len=0"
"38","4.846969","65.208.228.223","145.254.160.237","HTTP/XML","478","HTTP/1.1 200 OK "
"39","5.017214","145.254.160.237","65.208.228.223","TCP","54","3372  >  80 [ACK] Seq=480 Ack=18365 Win=9236 Len=0"
"40","17.905747","65.208.228.223","145.254.160.237","TCP","54","80  >  3372 [FIN, ACK] Seq=18365 Ack=480 Win=6432 Len=0"
"41","17.905747","145.254.160.237","65.208.228.223","TCP","54","3372  >  80 [ACK] Seq=480 Ack=18366 Win=9236 Len=0"
"42","30.063228","145.254.160.237","65.208.228.223","TCP","54","3372  >  80 [FIN, ACK] Seq=480 Ack=18366 Win=9236 Len=0"
"43","30.393704","65.208.228.223","145.254.160.237","TCP","54","80  >  3372 [ACK] Seq=18366 Ack=481 Win=6432 Len=0"
